{
  "$schema": "https://json-schema.org/draft/2020-12/schema",
  "$id": "https://primecontext.dev/schemas/v0.1/compact-handoff.schema.json",
  "type": "object",
  "additionalProperties": false,
  "required": [
    "schema_version",
    "task_id",
    "status",
    "changed_files",
    "tests",
    "risks",
    "next_unblocked"
  ],
  "properties": {
    "schema_version": {
      "const": "0.1"
    },
    "task_id": {
      "type": "string",
      "minLength": 1,
      "maxLength": 128,
      "pattern": "^(?!(?:[Cc][Oo][Nn]|[Pp][Rr][Nn]|[Aa][Uu][Xx]|[Nn][Uu][Ll]|[Cc][Oo][Mm][1-9]|[Ll][Pp][Tt][1-9])(?:\\.|(?![\\s\\S])))[A-Za-z0-9](?:[A-Za-z0-9._-]{0,126}[A-Za-z0-9_-])?(?![\\s\\S])"
    },
    "status": {
      "enum": [
        "PASS",
        "FAIL",
        "PARTIAL",
        "BLOCKED"
      ]
    },
    "commit": {
      "type": "string",
      "minLength": 1
    },
    "changed_files": {
      "type": "array",
      "items": {
        "type": "string",
        "minLength": 1
      }
    },
    "interfaces_added": {
      "type": "array",
      "items": {
        "type": "string",
        "minLength": 1
      }
    },
    "decisions": {
      "type": "array",
      "items": {
        "type": "string",
        "minLength": 1
      }
    },
    "tests": {
      "type": "object",
      "additionalProperties": false,
      "required": [
        "passed",
        "failed"
      ],
      "properties": {
        "passed": {
          "type": "integer",
          "minimum": 0,
          "maximum": 9007199254740991
        },
        "failed": {
          "type": "integer",
          "minimum": 0,
          "maximum": 9007199254740991
        },
        "skipped": {
          "type": "integer",
          "minimum": 0,
          "maximum": 9007199254740991
        }
      }
    },
    "risks": {
      "type": "array",
      "items": {
        "type": "string",
        "minLength": 1
      }
    },
    "next_unblocked": {
      "type": "array",
      "items": {
        "type": "string",
        "minLength": 1
      }
    },
    "artifacts": {
      "type": "array",
      "items": {
        "type": "string",
        "minLength": 1
      }
    },
    "metrics_ref": {
      "type": "string",
      "minLength": 1
    }
  }
}
